{
  "symbol": "gCategoryFamily1AnimTable",
  "family": "JETPACK",
  "records": [
    {"keyframes": "gJetpackPlayerKeyframes", "frames": "gJetpackPlayerFrames", "palette": 0, "depth": 7168, "box": [-10, -20, -1, 20, 42, 3]},
    {"keyframes": "gJetpackPlaneKeyframes", "frames": "gJetpackPlaneFrames", "palette": 2, "depth": 9216, "box": [-32, -16, -2, 64, 32, 4]},
    {"keyframes": "gJetpackShotKeyframes", "frames": "gJetpackShotFrames", "palette": 1, "depth": 11264, "box": [-12, -12, -2, 24, 24, 4]},
    {"keyframes": "gJetpackCannonballKeyframes", "frames": "gJetpackCannonballFrames", "palette": 2, "depth": 10752, "box": [-6, -6, -2, 12, 12, 4]},
    {"keyframes": "gJetpackBomberKeyframes", "frames": "gJetpackBomberFrames", "palette": 2, "depth": 9216, "box": [-16, -16, -2, 32, 32, 4]},
    {"keyframes": "gJetpackBomberKeyframes", "frames": "gJetpackBomberFrames", "palette": 2, "depth": 9216, "box": [-16, -16, -2, 32, 32, 4]},
    {"keyframes": "gJetpackBomberKeyframes", "frames": "gJetpackBomberFrames", "palette": 2, "depth": 9216, "box": [-16, -16, -2, 32, 32, 4]},
    {"keyframes": "gJetpackBomberKeyframes", "frames": "gJetpackBomberFrames", "palette": 2, "depth": 9216, "box": [-16, -16, -2, 32, 32, 4]},
    {"keyframes": "gJetpackBomberKeyframes", "frames": "gJetpackBomberFrames", "palette": 2, "depth": 9216, "box": [-16, -16, -2, 32, 32, 4]},
    {"keyframes": "gJetpackBomberKeyframes", "frames": "gJetpackBomberFrames", "palette": 2, "depth": 9216, "box": [-16, -16, -2, 32, 32, 4]},
    {"keyframes": "gHovercraftCannonKeyframes", "frames": "gHovercraftCannonFrames", "palette": 10, "depth": 11264, "box": [-8, -8, -2, 16, 16, 4]},
    {"keyframes": "gHovercraftCannonKeyframes", "frames": "gHovercraftCannonFrames", "palette": 10, "depth": 11264, "box": [-8, -8, -2, 16, 16, 4]},
    {"keyframes": "gHovercraftLauncherKeyframes", "frames": "gHovercraftLauncherFrames", "palette": 10, "depth": 11264, "box": [-8, -8, -2, 16, 16, 4]},
    {"keyframes": "gHovercraftSideGunKeyframes", "frames": "gHovercraftSideGunFrames", "palette": 10, "depth": 11264, "box": [-8, -8, -2, 16, 16, 4]},
    {"keyframes": "gHovercraftCannonFlashKeyframes", "frames": "gHovercraftCannonFlashFrames", "palette": 4, "depth": 11264, "box": [-8, -8, -2, 16, 16, 4]},
    {"index": 0, "keyframes": "gHovercraftCannonKeyframes", "frames": "gHovercraftCannonFrames", "palette": 10, "depth": 11264, "box": [-8, -8, -2, 16, 16, 4]},
    {"keyframes": "gHovercraftCannonKeyframes", "frames": "gHovercraftCannonFrames", "palette": 10, "depth": 11264, "box": [-8, -8, -2, 16, 16, 4]},
    {"keyframes": "gHovercraftCannonKeyframes", "frames": "gHovercraftCannonFrames", "palette": 10, "depth": 11264, "box": [-8, -8, -2, 16, 16, 4]},
    {"keyframes": "gHovercraftCannonKeyframes", "frames": "gHovercraftCannonFrames", "palette": 10, "depth": 11264, "box": [-8, -8, -2, 16, 16, 4]},
    {"keyframes": "gJetpackCrateKeyframes", "frames": "gJetpackQuestionCrateFrames", "palette": 7, "depth": 9216, "box": [-11, -16, -2, 22, 22, 4]},
    {"keyframes": "gJetpackCrateKeyframes", "frames": "gJetpackQuestionCrateFrames", "palette": 7, "depth": 9216, "box": [-11, -16, -2, 22, 22, 4]},
    {"keyframes": "gJetpackCrateKeyframes", "frames": "gJetpackQuestionCrateFrames", "palette": 7, "depth": 9216, "box": [-11, -16, -2, 22, 22, 4]},
    {"keyframes": "gJetpackCrateKeyframes", "frames": "gJetpackQuestionCrateFrames", "palette": 7, "depth": 9216, "box": [-11, -16, -2, 22, 22, 4]},
    {"keyframes": "gJetpackCrateKeyframes", "frames": "gJetpackQuestionCrateFrames", "palette": 7, "depth": 9216, "box": [-11, -16, -2, 22, 22, 4]},
    {"keyframes": "gJetpackCrateKeyframes", "frames": "gJetpackTimeCrate1Frames", "palette": 5, "depth": 9216, "box": [-11, -16, -2, 22, 22, 4]},
    {"keyframes": "gJetpackCrateKeyframes", "frames": "gJetpackTimeCrate2Frames", "palette": 5, "depth": 9216, "box": [-11, -16, -2, 22, 22, 4]},
    {"keyframes": "gJetpackCrateKeyframes", "frames": "gJetpackTimeCrate3Frames", "palette": 5, "depth": 9216, "box": [-11, -16, -2, 22, 22, 4]},
    {"keyframes": "gJetpackParachuteNitroKeyframes", "frames": "gJetpackParachuteNitroFrames", "palette": 8, "depth": 9216, "box": [-21, 5, -2, 32, 31, 4]},
    {"keyframes": "gJetpackRocketKeyframes", "frames": "gJetpackRocketFrames", "palette": 5, "depth": 9216, "box": [-4, -21, -2, 8, 42, 4]},
    {"keyframes": "gJetpackStopwatchKeyframes", "frames": "gJetpackStopwatchFrames", "palette": 5, "depth": 9216, "box": [-17, 4, -2, 25, 24, 4]},
    {"keyframes": "gJetpackRocketKeyframes", "frames": "gJetpackRocketFrames", "palette": 5, "depth": 9216, "box": [-17, 4, -2, 25, 24, 4]},
    {"keyframes": "gJetpackRingLeftKeyframes", "frames": "gJetpackRingFrames", "palette": 11, "depth": 7168, "box": [3, -19, -2, 50, 38, 4], "spawn_x": -7168},
    {"keyframes": "gHovercraftCannonKeyframes", "frames": "gHovercraftCannonFrames", "palette": 10, "depth": 11264, "box": [-8, -8, -2, 16, 16, 4]},
    {"keyframes": "gHovercraftCannonKeyframes", "frames": "gHovercraftCannonFrames", "palette": 10, "depth": 11264, "box": [-8, -8, -2, 16, 16, 4]},
    {"keyframes": "gHovercraftCannonKeyframes", "frames": "gHovercraftCannonFrames", "palette": 10, "depth": 11264, "box": [-8, -8, -2, 16, 16, 4]},
    {"keyframes": "gHovercraftCannonKeyframes", "frames": "gHovercraftCannonFrames", "palette": 10, "depth": 11264, "box": [-8, -8, -2, 16, 16, 4]},
    {"keyframes": "gHovercraftCannonKeyframes", "frames": "gHovercraftCannonFrames", "palette": 10, "depth": 11264, "box": [-8, -8, -2, 16, 16, 4]},
    {"keyframes": "gHovercraftCannonKeyframes", "frames": "gHovercraftCannonFrames", "palette": 10, "depth": 11264, "box": [-8, -8, -2, 16, 16, 4]},
    {"keyframes": "gBossFireballKeyframes", "frames": "gBossFireballFrames", "palette": 3, "depth": 7168, "box": [-8, -8, -2, 16, 16, 4]},
    {"keyframes": "gBossFireballKeyframes", "frames": "gBossFireballFrames", "palette": 3, "depth": 7168, "box": [-8, -8, -2, 16, 16, 4]},
    {"keyframes": "gJetpackBalloonKeyframes", "frames": "gJetpackRedBalloonFrames", "palette": 5, "depth": 9216, "box": [-17, -38, -2, 53, 16, 4]},
    {"keyframes": "gJetpackBalloonKeyframes", "frames": "gJetpackYellowBalloonFrames", "palette": 6, "depth": 9216, "box": [-17, -38, -2, 53, 16, 4]},
    {"keyframes": "gJetpackBalloonKeyframes", "frames": "gJetpackRedCrossBalloonFrames", "palette": 7, "depth": 9216, "box": [-17, -38, -2, 53, 16, 4]},
    {"keyframes": "gJetpackRingRightKeyframes", "frames": "gJetpackRingFrames", "palette": 11, "depth": 7168, "box": [0, 0, 0, 0, 0, 0], "spawn_x": 7168},
    {"keyframes": "gJetpackCollectedWumpaKeyframes", "frames": "gJetpackCollectedWumpaFrames", "palette": 9, "depth": 7168, "box": [0, 0, 0, 0, 0, 0]},
    {"keyframes": "gJetpackExplosionKeyframes", "frames": "gJetpackExplosionFrames", "palette": 4, "depth": 11264, "box": [0, 0, 0, 0, 0, 0]},
    {"keyframes": "gJetpackCheckpointTextKeyframes", "frames": "gJetpackCheckpointTextFrames", "palette": 9, "depth": 11264, "box": [0, 0, 0, 0, 0, 0]}
  ],
  "arrays": [
    "table",
    {"keyframes": "gJetpackPlayerKeyframes", "list": [
      [64, 0, 18, 0, 0],
      [85, 18, 18, 0, 0],
      [85, 36, 18, 0, 0],
      [64, 54, 18, 17, 0],
      [42, 72, 18, 17, 0],
      [42, 72, 8, 7, 0]
    ]},
    {"player_frames": "gJetpackPlayerFrames", "list": [
      18, 19, 20, 21, 22, 23, 24, 25, 26, 27, 28, 29, 30, 31, 32, 33,
      34, 35, 36, 37, 38, 39, 40, 41, 42, 43, 44, 45, 46, 47, 48, 49,
      50, 51, 52, 53, 54, 55, 56, 57, 58, 59, 60, 61, 62, 63, 64, 65,
      66, 67, 68, 69, 70, 71, 0, 1, 2, 3, 4, 5, 6, 7, 8, 9,
      10, 11, 12, 13, 14, 15, 16, 17, 72, 73, 74, 75, 76, 77, 78, 79,
      79, 79, 79, 79, 79, 79, 79, 79, 79, 79
    ]},
    {"keyframes": "gJetpackShotKeyframes", "list": [
      [64, 0, 3, 0, 0]
    ]},
    {"frames": "gJetpackShotFrames", "list": [
      "shot/00", "shot/01", "shot/02"
    ]},
    {"keyframes": "gJetpackPlaneKeyframes", "list": [
      [64, 0, 3, 0, 0],
      [64, 3, 6, 5, 0],
      [64, 9, 7, 0, 0],
      [64, 16, 3, 0, 0],
      [64, 19, 6, 5, 0],
      [64, 25, 7, 0, 0]
    ]},
    {"frames": "gJetpackPlaneFrames", "list": [
      "plane/00", "plane/01", "plane/02", "plane/10", "plane/11", "plane/12",
      "plane/13", "plane/14", "plane/15", "plane/03", "plane/04", "plane/05",
      "plane/06", "plane/07", "plane/08", "plane/09", "plane/16", "plane/17",
      "plane/18", "plane/26", "plane/27", "plane/28", "plane/29", "plane/30",
      "plane/31", "plane/19", "plane/20", "plane/21", "plane/22", "plane/23",
      "plane/24", "plane/25"
    ]},
    {"keyframes": "gJetpackBomberKeyframes", "list": [
      [64, 0, 10, 0, 0],
      [51, 10, 10, 9, 0]
    ]},
    {"frames": "gJetpackBomberFrames", "list": [
      "bomber/00", "bomber/01", "bomber/02", "bomber/03", "bomber/04", "bomber/05",
      "bomber/06", "bomber/07", "bomber/08", "bomber/09", "explosion/00", "explosion/01",
      "explosion/02", "explosion/03", "explosion/04", "explosion/05", "explosion/06", "explosion/07",
      "explosion/08", "explosion/09"
    ]},
    {"keyframes": "gJetpackCannonballKeyframes", "list": [
      [64, 0, 1, 0, 0]
    ]},
    {"frames": "gJetpackCannonballFrames", "list": [
      "cannonball/00"
    ]},
    {"keyframes": "gBossFireballKeyframes", "list": [
      [42, 0, 8, 0, 0],
      [42, 8, 10, 9, 0]
    ]},
    {"frames": "gBossFireballFrames", "list": [
      "fireball/00", "fireball/01", "fireball/02", "fireball/03", "fireball/04", "fireball/05",
      "fireball/06", "fireball/07", "fireball_burst/00", "fireball_burst/01", "fireball_burst/02", "fireball_burst/03",
      "fireball_burst/04", "fireball_burst/05", "fireball_burst/06", "fireball_burst/07", "fireball_burst/08", "fireball_burst/09"
    ]},
    {"keyframes": "gHovercraftCannonKeyframes", "list": [
      [64, 0, 1, 0, 0],
      [64, 0, 11, 0, 0],
      [64, 11, 14, 11, 0]
    ]},
    {"frames": "gHovercraftCannonFrames", "list": [